question,Subject,answer1,answer2,answer3,answer4,Correct_answer
Как называется боковая часть пистолета?,Разное,Щека,Лоб,Спина,Затылок,Щека
С каким философом Екатерина II вела дружескую переписку?,История,Вольтер,Декарт,Руссо,Паскаль,Вольтер
"Рояли какой фирмы после советской национализации назывались ""Красный Октябрь""? ",Разное,"""Беккер""","""Бехштейн"""," ""Блютнер"""," ""Стейнвей""","""Беккер"""
Кто в юном возрастел был избран жрецом Юпитера и не имел права садится на коня?,История,Юлий Цезарь,Марк Антоний,Гней Помпей,Марк Аврелий,Юлий Цезарь
Уравнение Максвелла относится к...,Наука,Электромагнетизму,Классической механике,Статике,Квантовой механике,Электромагнетизму
"Как называлась античная мера длины, составляющая чуть меньше двух метров? ",История,оргия,вакханалия,сатурналия,бардак,оргия
Во что Онегин играл сам с собой в доме своего дяди?,Литература,бильярд,шахматы,домино,рулетка,бильярд
Какой буквой греческого алфавита обозначается отношение длины окружности к её диаметру?,Наука,Пи,Гамма,Бета,Альфа,Пи
Какая мышца в теле человека самая крупная?,Природа и животный мир,Ягодичная,Грудная,Икроножная,Дельтовидная,Ягодичная
Какого цвета были московские метели в песне Пахмутовой?,Искусство,Синего,Серого,Белого,Черного,Синего
"Переход к демократической форме правления в какой стране был назван ""бархатной революцией""? ",История,Чехословакия,Португалия,Испания,Польша,Чехословакия
На какой реке стоит Минск?,География,Свислочь,Сож,Буг,Западная Двина,Свислочь
"Какой древнегреческий философ любил повторять: ""Я знаю, что ничего не знаю""? ",История,Сократ,Демокрит,Эпикур,Аристотель,Сократ
На каком из этих спутников предполагают наличие жидких морей подо льдом?,Наука,Европа,Ио,Деймос,Харон,Европа
Какие водные артерии Петербурга соединяет Зимняя канавка?,География,Неву с Мойкой,Мойку с каналом Грибоедова,Обводный канал с Фонтанкой,Фонтанку с каналом Грибоедова,Неву с Мойкой
Как называется один из притоков Невы?,География,Пряжка,Стежка,Кружка,Ложка,Пряжка
В какой стране Элвис Пресли дал концерты в 1957 году?,Искусство,Канада,Мексика,Франция,Великобритания,Канада
Композитор Альфред Шнитке родился в городе…,Искусство,Энгельс,Карл-Маркс-Штадт,Ленинск,Сталинград,Энгельс
Какой художник рисует животных?,Искусство,анималист,баталист,маринист,пейзажист,анималист
Назовите год присуждения Михаилу Горбачеву Нобелевской премии мира.,История,1990,1991,1989,1988,1990
Какая форма государственного правления Сан-Марино?,История,Республика,Княжество,Герцогство,Архиепископство,Республика
За чью дочь выдавала себя княжна Тараканова?,Литература,Елизаветы Петровны,Анны Иоанновны,Екатерины I,Петра III,Елизаветы Петровны
"какой пьесе Шекспира Мендельсон написал мелодию, известную как свадебный марш? ",Литература,«Сон в летнюю ночь»,«Много шума из ничего»,«Укрощение строптивой»,«Комедия ошибок»,«Сон в летнюю ночь»
"Как в государственном праве называется официальное провозглашение (обнародование) закона, принятого парламентом? ",Разное,Промульгация,Пролификация,Пролексизация,Пролиферация,Промульгация
Где были изготовлены самые первые (из дошедших до нас) монеты?,История,Лидия,Рим,Шумер,Израиль,Лидия
Каким воинским подразделением в 1919 году командовал Чапаев?,История,Дивизией,Корпусом,Взводом,Полком,Дивизией
"Назовите имя героини драмы М. Ю. Лермонтова ""Маскарад"" ",Литература,Нина,Мария,Китти,Лиза,Нина
"Как называется пневматический ""молоток"" для взламывания асфальта? ",Разное,Отбойный,Забойный,Убойный,Бесшумный,Отбойный
"Что посетила Алиса, попав в Страну чудес? ",Литература,Безумное чаепитие,Глупый завтрак,Непродуманный обед,Безобразный ужин,Безумное чаепитие
Какой из городов является столицей Швейцарской конфедерации?,География,Берн,Базель,Цюрих,Женева,Берн
Какой химический элемент был впервые получен из морских водорослей?,Наука,Йод,Фосфор,Сера,Калий,Йод
Вождём какого племени был Монтесума?,История,Ацтеки,Майя,Инки,Ирокезы,Ацтеки
"В каком направлении НАСА запускает ракеты, чтобы получить преимущество от вращения Земли? ",Наука,Восток,Север,Юг,Запад,Восток
Какой город был центром русской колонизации Сибири?,История,Тобольск,Томск,Тюмень,Иркутск,Тобольск
В каком созвездии самая яркая звезда называется Вега?,Наука,Лира,Орёл,Гончие Псы,Большая Медведица,Лира
Какое отчество было у Пьера Безухова?,Литература,Кириллович,Александрович,Константинович,Владимирович,Кириллович
Чего так боится бленнофоб?,Разное,Слизи,Пыли,Голубого цвета,Длинных волос,Слизи
Кто победил на конкурсе ''Мисс Мира'' в 1994 году?,Искусство,Айшвария Рай,Талиана Варгас,Алёна Казимировская,Инна Зобова,Айшвария Рай
Модификацией какого химического элемента является графит?,Наука,Углерод,Свинец,Железо,Кремний,Углерод
К какому классу относится большинство известных видов животных?,Природа и животный мир,Насекомые,Млекопитающие,Рыбы,Птицы,Насекомые
Как в досоветской России называлась стоянка извозчиков?,Разное,Биржа,Рынок,Ставка,Торги,Биржа
Как называется южноамериканский аналог степи?,География,Пампасы,Саванна,Тундра,Прерия,Пампасы
"Как называют боковые побеги томата, вырастающие из пазух листьев? ",Природа и животный мир,Пасынки,Свояки,Золовки,Падчерицы,Пасынки
Сколько резцов во рту здорового человека?,Разное,8,6,2,4,8
На какой конференции союзники по антигитлеровской коалиции создали ООН?,История,Сан-Франциской,Тегеранской,Постдамской,Ялтинской,Сан-Франциской
Какая организация ведала в России XVIII века государственными расходами?,История,Штатс-коллегия,Юстиц-коллегия,Ревизион-коллегия,Камер-коллегия,Штатс-коллегия
В каком городе был открыт первый в СССР рок-клуб?,История,Ленинград,Москва,Вильнюс,Тбилиси,Ленинград
"Название какого животного с греческого переводится как ""водяная лошадь""? ",Природа и животный мир,Гиппопотам,Носорог,Утконос,Ламантин,Гиппопотам
Какая страна ежегодно дарит Великобритании к Рождеству роскошную ёлку?,Разное,Норвегия,Финляндия,Швеция,Дания,Норвегия
Как с исландского переводится имя певицы Бьорк?,Искусство,Берёза,Осина,Ольха,Ясень,Берёза
Назовите административный центр Амурской области.,География,Благовещенск,Хабаровск,Владивосток,Иркутск,Благовещенск
"Какую фамилию носила управдом в фильме ""Бриллиантовая рука"" в исполнении Нонны Мордюковой? ",Фильмы,Плющ,Хвощ,Мощь,Борщ,Плющ
Кем по специальности был Петр Ильич Чайковский?,Искусство,Юристом,Химиком,Художником,Врачом,Юристом
"Какого путешественника туземцы Новой Гвинеи прозвали ""человеком с луны""? ",География,Миклухо-Маклая,Джеймса Кука,Френсиса Дрейка,Тура Хейердала,Миклухо-Маклая
"Отзвук произведения какого автора использовал А.С.Пушкин в первой строке ""Евгения Онегина""? ",Литература,Крылов,Державин,Барков,Лафонтен,Крылов
Из скольки фунтов состоит американская тонна?,Разное,2000,1000,200,100,2000
"Укажите название свободного населения Древней Греции, обладавшего гражданскими правами ",История,Демос,Метеки,Демиурги,Периэки,Демос
Из чего сделан корпус кларнета?,Искусство,древесина,никель,олово,медь,древесина
Кто был первым талисманом чемпионата мира по футболу?,Спорт,Львёнок Вилли,Пастушок Гаучито,Пёс Стайкер,Петушок Футикс,Львёнок Вилли
Какая точка одинакова для шкал Цельсия и Фаренгейта (оба термометра покажут одно и то же)?,Наука,-40 градусов,0 градусов,+32 градуса,-18 градусов,-40 градусов
"Как говорят о человеке, у которого нижняя одежда торчит из-под верхней? ",Разное,из-под пятницы суббота,из-под зимы лето,из-под утра вечер,семь пятниц на неделе,из-под пятницы суббота
"Кто написал «Камаринскую», о которой П. И. Чайковский сказал, что в ней «заключена вся русская симфоническая музыка»? ",Искусство,М. И. Глинка,Н. А. Римский-Корсаков,М. П. Мусоргский,А. П. Бородин,М. И. Глинка
Король какой страны подарил Петру I Янтарную комнату?,История,Пруссии,Швеции,Франции,Дании,Пруссии
Какая достопримечательность находится на берегу реки Джамна?,География,Тадж Махал,Ангкорвоат,Топкапы,Запретный город,Тадж Махал
"Какая рыба, чтобы освободиться от крючка, часто ""делает свечу""? ",Природа и животный мир,Щука,Осетр,Налим,Карась,Щука
"Кто из лауреатов Нобелевской премии является одним из ""отцов"" лазера? ",Наука,А. М. Прохоров,П. Л. Капица,А. Д. Сахаров,Л. Д. Ландау,А. М. Прохоров
Монахи какого ордена ведали инквизицией наряду с доминиканцами?,История,Францисканцы,Бернардинцы,Паулины,Бенедиктинцы,Францисканцы
"Кто из этих великих целителей прошлого написал трактат ""О медицине""? ",История,Цельс,Гиппократ,Авиценна,Парацельс,Цельс
"Как назывался пражский трактир, в котором арестовали бравого солдата Швейка? ",Литература,"""У чаши""","""У площади"""," ""У кружки"""," ""У рюмашки""","""У чаши"""
Кто был первым чемпионом мира по шахматам?,Спорт,Стейниц,Ласкер,Алехин,Калабланка,Стейниц
Из чего сделаны пластинки ксилофона?,Искусство,Из дерева,Из пластмассы,Из меди,Из стали,Из дерева
Какой остров раньше назывался Формозой?,География,Тайвань,Таити,Гаити,Калимантан,Тайвань
Какой химический элемент имеет символ Rn?,Наука,Радон,Рутений,Рений,Рубидий,Радон
От слова какого языка произошло слово хоругвь?,Разное,Монгольский,Польский,Старославянский,Крымскотатарский,Монгольский
"Какие животные, согласно ""Илиаде"", содержались в стойлах царя Авгия, которые очистил Геракл? ",История,Быки,Овцы,Лошади,Единороги,Быки
Чьё имя до 1924 года носила пионерская организация Советского Союза?,История,Спартака,Ленина,Троцкого,Макаренко,Спартака
В каком городе обосновалось коллаборационистское правительство Петена в период оккупации Франции немецкими войсками?,История,Виши,Реймс,Шартр,Бурж,Виши
"Как называлась северо-восточная часть франкского государства Меровингов, в 6-7 вв. временами обособлявшаяся в отдельное королевство? ",История,Австразия,Дакия,Франкония,Остзея,Австразия
"Название какого головного убора само говорит, что его задача — создавать тень? ",Разное,сомбреро,канотье,панама,стетсон,сомбреро
Где были выкованы металлические звенья Невской ограды Летнего сада?,Разное,В Туле,В Екатеринбурге,В Санкт-Петербурге,В Москве,В Туле
"Кто создал Лестерский кодекс - тетрадь научных работ, которую Билл Гейтс приобрел за 30 миллионов долларов? ",Наука,Леонардо да Винчи,Лейф Эрикссон,Юлий Цезарь,Иоганн Гутенберг,Леонардо да Винчи
Чего боится охлофоб?,Разное,Толпы,Змей,Открытого пространства,Наказания,Толпы
"Как в Древнем Риме называли жрецов (или жриц), гадавших только по внутренностям жертвенных животных? ",История,Гаруспики,Авгуры,Весталки,Бестиарии,Гаруспики
Какой хан Золотой Орды ввел там ислам в качестве государственной религии?,История,Узбек,Азис,Тохтамыш,Чжанибек,Узбек
Что создал выходец из России Давид Сарнов?,Разное,NBC,MTV,CNN,BBC,NBC
Кто такие парсы?,Разное,Зороастрийцы,Каста в Индии,Исмаилиты,Ловцы жемчуга,Зороастрийцы
"Каким типом корабля был ""Кореец"", храбро сражавшийся вместе с ""Варягом"" против японской эскадры? ",История,Канонерская лодка,Миноносец,Торпедный катер,Десантный корабль,Канонерская лодка
В каком месяце 1941 г. японская авиация напала на Пёрл-Харбор?,История,Декабрь,Сентябрь,Октябрь,Ноябрь,Декабрь
"Как звали царя, трое сыновей которого тоже стали русскими царями? ",История,Алексей,Михаил,Фёдор,Пётр,Алексей
Какая участь постигла национальное достояние Южной Кореи — городские ворота XIV века Суннемун?,История,их сжёг злоумышленник,разрушены землетрясением,съедены жучком,разрушены землетрясением,их сжёг злоумышленник
Что в Якутии после Октябрьской революции 1917 года использовали вместо бумажных денег?,История,винные этикетки,берестяные грамоты,почтовые марки,театральные билеты,винные этикетки
В каком году Фернан Магеллан отправился в кругосветное плаванье?,История,1519,1542,1507,1531,1519
Последняя жена Генриха VIII,История,Екатерина Парр,Екатерина Ховард,Анна Клевская,Евгения Сеймор,Екатерина Парр
На какой радиостанции работает Николай Фоменко?,Искусство,Русское радио,Наше радио,Не наше радио,Европа плюс,Русское радио
Выше какого здания Николай I запретил строить дома в Санкт-Петербурге?,История,Зимний дворец,Исаакиевский собор,Смольный институт,Адмиралтейство,Зимний дворец
Из чего в Японии делают нэцкэ?,Разное,"Дерево, кость",Бобы,свинина,Рыба,"Дерево, кость"
Какую внешнюю политику называют дипломатией канонерок?,Разное,Открытого насилия,Консервативную,Выжидательную,Дружественную,Открытого насилия
"Как называется коллекционирование музыкальных, литературных и других звукозаписей? ",Разное,Филофония,Филокартия,Филумения,Филателия,Филофония
Чьим спутником является Харон?,Наука,Плутона,Нептуна,Юпитера,Урана,Плутона
В каком из этих фильмов две главные роли сыграли Л. Касаткина и П. Кадочников?,Фильмы,"""Медовый месяц""","""Укрощение строптивой"""," ""Вызываем огонь на себя"""," ""Мать Мария""","""Медовый месяц"""
"В какую часть ""Божественной комедии"" Данте поместил Адама? ",Литература,"""Рай""","""Ад"""," ""Чистилище""",Он не писал о нем,"""Рай"""
Чему равен один британский фут?,Разное,30.48 см,30.50 см,30.52 см,30.43 см,30.48 см
"Какая самая высокая гора на Урале, если считать до начала разработки некоторых из них? ",География,Народная,Благодать,Магнитная,Ямантау,Народная
Кто был вторым космонавтом?,История,Титов,Гагарин,Терешкова,Армстронг,Титов
Кто такая золовка?,Разное,Сестра мужа,Сестра жены,Жена брата,Дочь крестной,Сестра мужа
К каким обезьянам относился Пират. сыгравший в фильме «Полосатый рейс»?,Фильмы,Шимпанзе,Мартышки,Макаки,Павианы,Шимпанзе
Кто из конкистадоров покорил империю инков?,История,Франсиско Писарро,Васко Нуньес де Бальбоа,Эрнан Кортес,Франсиско де Орельяна,Франсиско Писарро
Какую продукцию долгое время единственный в стране выпускал Сясьский комбинат в Ленинградской области?,Разное,Туалетную бумагу,Спички,Клей,Телевизоры,Туалетную бумагу
Назовите основную денежную единицу Венгрии?,Разное,Форинт,Лев,Фартинг,Толар,Форинт
Назовите природную среду обитания страуса эму,Природа и животный мир,Австралия,Африка,Южная Америка,Индонезия,Австралия
Кого или что Леонид Семаков в своей песне назвал зеленогорбыми верблюдами?,Искусство,туристов,черепах,волны,холмы,туристов
Что изучает колеоптеролог?,Природа и животный мир,Жуков,Ископаемых птиц,Змей,Червей,Жуков
"Кем, согласно древнегреческой мифологии, Электра приходилась Оресту? ",История,Сестра,Мать,Дочь,Жена,Сестра
Как называются денежные купюры Армении?,Разное,драмы,комедии,трагедии,фарсы,драмы
Что на Руси называли ветрилом?,История,Парус,Киль,Палубу,Борт,Парус
Облик каких животных принимают отражения лебедей на картине Сальвадора Дали?,Искусство,слонов,жирафов,пингвинов,страусов,слонов
