question,Subject,answer1,answer2,answer3,answer4,Correct_answer
"Кому приходилось заниматься разделыванием под орех, что и породило известный неологизм? ",Разное,столяру,повару,конюху,кузнецу,столяру
Какой народный промысел прославил тобольских мастеров?,История,резьба по кости,чугунное литьё,малахитовые шкатулки,пуховые платки,резьба по кости
"Кто, по русским летописям, заселил европейскую часть нынешней России после потопа? ",История,Иафет,Хам,Ной,Сим,Иафет
Какой жанр голандской живописи 17 века предназначался для напоминания о быстротечности жизни и неизбежности смерти?,Искусство,Ванитас,Готика,Бодегон,Бомбочады,Ванитас
Как по-научному называется выгорание взрывчатого вещества?,Наука,Дефлаграция,Диффамация,Эксплорация,Дефламмизация,Дефлаграция
"Что хакеры называют ""пагой""? ",Разное,Web-страничку,Погоду,Игру,Пейджер,Web-страничку
Какой римский император был отцом императора Тита?,История,Веспасиан,Адриан,Домициан,Клавдий,Веспасиан
Как раньше называлась игра в шахматы?,История,Чатуранга,Чачуранга,Матуранга,Пануранга,Чатуранга
В какой пустыне в 1923 году были впервые обнаружены остатки гнезд динозавров с лежащими там окаменевшими яйцами?,История,Гоби,Ливийская,Калахари,Атакама,Гоби
"Что такое ферменты, биологические катализаторы? ",Наука,Белки,Кислоты,Жиры,Паразиты,Белки
На какой реке стоит город Прага?,География,Влтава,Тиса,Лаба,Одра,Влтава
Как в 1987 году назывался город Набережные Челны?,География,Брежнев,Суслов,Андропов,Подгорный,Брежнев
"Известно, что некоторые буквы кириллицы имели и цифровое значение. Чему равнялась буква ""Ферт""? ",Разное,500,300,400,600,500
Какой калибр у автоматической винтовки М16 производства США?,Разное,5.56 мм,7.56 мм,9-й калибр,113 дюйма,5.56 мм
Какой бег упомянут в названии короткометражки Леонида Гайдая?,Спорт,кросс,трусца,стипль-чез,марафон,кросс
"Что, по мнению Веры из к/ф ""Служебный роман"", делает женщину женщиной? ",фильмы,Обувь,Прическа,Обувь,Макияж,Обувь
Как называется соревнование разных по классу участников с предоставлением форы слабейшим?,Спорт,Гандикап,Пелетон,Форманта,Ганглиоз,Гандикап
Какой напиток входит в коктейль «Свободная Куба»?,Разное,ром,виски,бренди,водка,ром
Что из этого является витамином?,Разное,Ретинол,Гамма-глоубин,Ализарин,Фенолфталеин,Ретинол
Кто из этих витязей не был рыцарем круглого стола?,История,Тристан,Парсифаль,Галахад,Ланселот,Тристан
В каком из этих фильмов не снимался Павел Луспекаев?,Фильмы,"""Дело пестрых""","""Республика ШКИД"""," ""Белое солнце пустыни"""," ""Тайна двух океанов""","""Дело пестрых"""
Национальным танцем какой страны является полька?,География,Чехия,Австрия,Венгрия,Польша,Чехия
Какой из этих спутников - спутник Сатурна?,Наука,Янус,Элара,Карме,Титания,Янус
Какая из этих звезд не входит в большой летний треугольник?,Наука,Сириус,Вега,Альтаир,Денеб,Сириус
Какая река имеет притоки Уругвай и Парагвай?,География,Парана,Колорадо,Миссисипи,Евфрат,Парана
Каких мужчин боятся больные погонофобией?,Разное,Бородатых,Лысых,Рыжих,Усатых,Бородатых
В какую страну вторглись советские войска 30 ноября 1939 года?,история,Финляндия,Польша,Иран,Румыния,Финляндия
Военно-политический союз России с какой страной стал предпосылкой образования Антанты?,история,Франция,Германия,Англия,Испания,Франция
Какая сельскохозяйственная культура сама удобряет почву?,Природа и животный мир,Горох,Свекла,Кукуруза,Рожь,Горох
Какой народ на Руси называли лопарями?,История,Саамов,Карелов,Ненцев,Коми,Саамов
"Как называется ненависть, нетерпимость к кому-либо или чему-либо чужому, незнакомому, непривычному? ",Разное,Ксенофобия,Иорофобия,Клаустрофобия,Агорафобия,Ксенофобия
Какое из этих австралийских животных не имеет сумки?,Природа и животный мир,Утконос,Ехидна,Коала,Вомбат,Утконос
Как называется двугорбый верблюд?,Природа и животный мир,Бактриан,Дромедар,Нар,Дромадер,Бактриан
Какая религия запрещает изображение человека в натуральную величину?,История,Ислам,Буддизм,Иудаизм,Христианство,Ислам
За достижения в какой области получил Нобелевскую премию главный редактор Большой советской энциклопедии Александр Прохоров?,Наука,физика,химия,физиология и медицина,литература,физика
Какого цвета ягоды ядовитого плюща?,Природа и животный мир,Белые,Синие,Красные,Черные,Белые
Что человек может сделать для гибискуса?,Природа и животный мир,полить,вычистить клетку,расчесать шерсть,поменять воду в аквариуме,полить
Какую музыкальную группу основал известный рок-певец Крис Норман?,Искусство,"""Smokie""","""Siade"""," ""Status Quo"""," ""Sweet""","""Smokie"""
Чем в Древней Греции руководил корифей?,История,хором,школой,посольством,строительством,хором
Какое вещество никогда не переходит в твёрдое состояние при нормальном давлении?,Наука,Гелий,Водород,Кислород,Азот,Гелий
Для какой нации романшский язык является национальным?,География,Швейцария,Австрия,Албания,Болгария,Швейцария
Что из этого остров (остальные - города)?,География,Санта-Исабель,Санта-Ана,Санта-Моника,Санта-Марта,Санта-Исабель
За какое время периода Земля оборачивается вокруг Солнца?,Природа и животный мир,За год,За месяц,За неделю,За сутки,За год
Какое из этих вин красное?,Разное,Мукузани,Ркацители,Цинандали,Гевюрцтраминер,Мукузани
Как называется самый многочисленный отряд млекопитающих?,Природа и животный мир,грызуны,хищные,кошачьи,приматы,грызуны
Кто в 1949 году стал первым канцлером ФРГ?,История,Аденауэр,Шмидт,Брандт,Эрхард,Аденауэр
Какой город оказался в блокаде во время Великой Отечественной войны?,История,Ленинград,Горький,Куйбышев,Киев,Ленинград
Где прожил последние годы до возвращения в США Эрнест Хемингуэй?,Литература,Куба,Испания,Ямайка,Гаити,Куба
Что является частью музыкального инструмента тромбона?,Искусство,кулиса,рампа,занавес,сцена,кулиса
Какая школа в 18 веке размещалась в Москве в Сухаревой башне?,История,навигацкая,пожарная,балетная,музыкальная,навигацкая
"Слово кибернетика - производное от греческого слова, означающего: ",Наука,Искусство управления,Быстрый счет,Божественное знание,Направленное действие,Искусство управления
Что обозначала буква О в аббревиатуре ОГПУ?,История,Объединенное,Общесоюзное,Оборонное,Отдельное,Объединенное
У автомобилей какой из этих стран международный регистрационный знак ES?,Разное,Сальвадор,Египет,Эстония,Испания,Сальвадор
"Как называли низкосортную, дешёвую колбасу? ",Разное,"""собачья радость""","""крокодиловы слёзы"""," ""телячьи нежности"""," ""лебединая песня""","""собачья радость"""
"Какое из этих мясных блюд, можно отнести к колбасным изделиям? ",Разное,Зельц,Бастурма,Карбонад,Буженина,Зельц
Музыка к какому балету написана не Родионом Щедриным?,Искусство,«Спартак»,«Чайка»,«Анна Каренина»,«Конёк-Горбунок»,«Спартак»
"Где два Стивена, Джобс и Возняк, собрали свой первый полноценный персональный компьютер? ",Наука,в гараже,на чердаке,на кухне,в сауне,в гараже
Кто стрелял в Мадонну во время выступления на стадионе Джонна Кеннеди?,Искусство,Шон Пенн,Уорен Битти,Хаттаб Эмир,Джон Хинки,Шон Пенн
Какой танец на придворных балах начала XIX века исполняли первым?,Искусство,Полонез,Менуэт,Вальс,Мазурка,Полонез
Какой город является административным центром (столицей) штата Техас?,География,Остин,Даллас,Хьюстон,Сан-Антонио,Остин
Как называется один из важнейших фондовых индексов в Японии?,География,Nikkei,Yisei,Nippon,Nisei,Nikkei
Какой город с 1845 по 1936 годы называли Тифлисом?,История,Тбилиси,Туапсе,Кутаиси,Сухуми,Тбилиси
"Как называется документ, определяющий правила награждения орденом и его ношения? ",Разное,Статут,Статус,Хартия,Устав,Статут
"Как назывался ящик, в который при царе Алексее Михайловиче складывали жалобы на дьяков и подьячих? ",История,долгий,короткий,чёрный,ящик Пандоры,долгий
"Кто автор подписи на Могиле Неизвестного Солдата «Имя твоё неизвестно, подвиг твой бессмертен»? ",История,Сергей Михалков,Максим Горький,Иосиф Сталин,Георгий Жуков,Сергей Михалков
Как настоящая фамилия Игоря Северянина?,Литература,Лотарев,Лопарев,Лекарев,Лазарев,Лотарев
"Как звали последнего царя Македонии, правившего до 168 г. до н. э.? ",История,Персей,Тесей,Протей,Антей,Персей
Как называется фильм Серджо Леоне?,Фильмы,«Однажды в Америке»,"""Порой в Европе""",«Раз в Африке»,«Когда-то в Антарктиде»,«Однажды в Америке»
"Кого В.Серов изобразил на картине ""Девочка с персиками""? ",Искусство,Дочь мецената Саввы Мамонтова,Племяннику Михаила Врубеля,Подружку сына Виктора Васнецова,Свою двоюродную сестру,Дочь мецената Саввы Мамонтова
В каком отделе позвоночника человека позвонки являются неподвижными?,Разное,В крестцовом,В шейном,В грудном,В поясничном,В крестцовом
Какую из этих пьес написал М. Булгаков?,Литература,"""Зойкина квартира""","""Машенька"""," ""Таня"""," ""Любовь Яровая""","""Зойкина квартира"""
"Судебный психиатр и криминалист, родоначальник антропологического направления в криминологии ",Разное,Ч. Ломброзо,Р. Ринальдини,Т. ди Лампедуза,Ф. Бартоломмео,Ч. Ломброзо
Какой из этих драгоценных камней является разновидностью минералов циркона?,Природа и животный мир,Гиацинт,Гелиодор,Альмандин,Хризопраз,Гиацинт
Кто из этих военачальников не был министром обороны СССР?,История,И. С. Конев,Г. К. Жуков,Р. Я. Малиновский,А. А. Гречко,И. С. Конев
Кто убил Петра Столыпина?,История,Богров,Засулич,Перовская,Азеф,Богров
"С кого собирал налоги Земский приказ, созданный в 1564 году и просуществовавший до 1699 года? ",История,с жителей Москвы,с крестьян российских деревень,с торговцев зерном,с крупных землевладельцев,с жителей Москвы
Чем или кем при российском дворе заведовал шталмейстер?,История,Царскими конюшнями,Царскими покоями,Царской псарней,Дворцовыми слугами,Царскими конюшнями
На гербе какого государства изображены черные пантеры?,География,Габон,Нигер,Малави,Кот-д'Ивуар,Габон
Какой нагревательный прибор не имеет фитиля?,Разное,примус,керосинка,керогаз,спиртовка,примус
Какое правило помогает определить направление магнитного поля электрического тока?,Наука,Правило буравчика,Правило винтика,Правило шпунтика,Правило шурупчика,Правило буравчика
"Что чинил кот-бегемот из романа ""Мастер и Маргарита""? ",Литература,примус,плитку,автомобиль,велосипед,примус
"Визитной карточкой какой рок-группы стали длиннющие, обычно рыжие, бороды солистов? ",Искусство,"""Зи Зи Топ""","""Пинк Флойд"""," ""Лед Зеппелин"""," ""Дип Пёрпл""","""Зи Зи Топ"""
Какое из этих деревьев - не из семейства березовых?,Наука,Берест,Ольха,Карельская береза,Граб,Берест
За чем не едет герой известной песенки Юрия Кукина?,Искусство,за деньгами,за мечтами,за туманом,за запахом тайги,за деньгами
"На фасаде какой гостиницы Москвы можно увидеть панно Врубеля ""Принцесса Грёза""? ",Искусство,"""Метрополь""","""Националь"""," ""Будапешт"""," ""Савой""","""Метрополь"""
"Что означает прозвище Калигула, под которым известен один из римских императоров? ",История,Сапожок,Ящерка,Маленький меч,Короткий плащ,Сапожок
"Какое животное изображено на картине Леонардо да Винчи ""Дама с горностаем""? ",Искусство,Хорек (альбинос),Горностай,Ласка,Норка,Хорек (альбинос)
"За что ответственна область мозга называемая ""область Вернике""? ",Разное,Понимание речи,Кратковременная память,Пространственное ощущение,Сон,Понимание речи
Какое море в XII - XIII века называлось Варяжским?,История,Балтийское,Чёрное,Азовское,Белое,Балтийское
Административным центром каких островов является город Гонолулу?,География,Гавайских,Панамских,Канарских,Вердинских,Гавайских
Какая российская теннисистка в 2004 году выиграла Уимблдонский турнир?,Спорт,М. Шарапова,Е. Дементьева,А. Мыскина,В. Звонарёва,М. Шарапова
"Какое министерство возглавлял Д. А. Гурьев, который придумал гурьевскую кашу? ",История,Финансов,Полиции,Юстиции,Морское,Финансов
Кто из этих биологов был пионером социобиологии?,Наука,Эдвард Осборн Уилсон,Джейн Гудолл,Стивен Гулд,Эрнст Майр,Эдвард Осборн Уилсон
Какой великий русский композитор одновременно был известным химиком?,Наука,Бородин,Римский-Корсаков,Даргомыжский,Глинка,Бородин
Что изучает семиотика?,Наука,Знаки и символы,Человекообразных обезьян,Происхождение слов,Флаги,Знаки и символы
В каком из этих алфавитов меньше всего букв?,Разное,Греческий,Латинский,Грузинский,Армянский,Греческий
Какой из учебных предметов не входит в КВАДРИВИУМ - следовавший за тривиумом повышенный цикл обучения в средние века?,История,Диалектика,Арифметика,Геометрия,Музыка,Диалектика
У кого внешний покров состоит из хитина?,Природа и животный мир,Членистоногие,Рыбы,Птицы,Млекопитающие,Членистоногие
"В каком монастыре восемь лет держали осаду монахи, не принявшие церковные реформы Никона? ",История,Соловецкий,Киевско-Печорский,Оптина Пустынь,Ипатьевский,Соловецкий
Кто из этих богов и богинь не был сыном или дочерью Зевса?,История,Деметра,Аполлон,Афина,Гермес,Деметра
Чему дал название хвост петуха?,Разное,смеси напитков (коктейль),стрижке панка,букету гладиолусов,детали токарного станка,смеси напитков (коктейль)
Решите древнеримский пример MD-CLXXX =?,История,MCCCXX,MCCLXX,MDLXXX,MCLXXX,MCCCXX
В какой стране зародился стиль рококо?,Искусство,Франция,Италия,Австрия,Испания,Франция
Что означает слово ТСУГА?,Природа и животный мир,Хвойное дерево,Лиственное дерево,Народ в Лесото,Народ в Ботсване,Хвойное дерево
Какая порода собак не существует?,Природа и животный мир,Монтефорт-терьер,Керн-терьер,Чешский терьер,Силихем-терьер,Монтефорт-терьер
Какие московские пруды назывались когда-то Погаными?,История,Чистые,Патриаршьи,Борисовские,Царицынские,Чистые
Каким стихотворным размером Гомер написал «Илиаду» и «Одиссею»?,Литература,гекзаметром,александрийским стихом,пятистопным ямбом,анапестом,гекзаметром
Какой стихотворный размер использовал А. С. Пушкин в стихотворении про Вещего Олега?,Литература,Амфибрахий,Дактиль,Анапест,Ямб,Амфибрахий
Как в России в старину называли изумруд?,История,Смарагд,Карбункул,Диамант,Яхонт,Смарагд
Кто из этих российских деятелей не имел титул светлейшего князя?,История,Ромодановский,Меншиков,Кутузов,Горчаков,Ромодановский
Какое из этих английских графств самое большое по территории?,География,Хэмпшир,Эссекс,Корнуолл,Стаффордшир,Хэмпшир
Сколько мачт у брига?,Разное,2,1,3,4,2
Что из перечисленного изготовляется не из абрикосов?,Разное,Сабза,Урюк,Кайса,Курага,Сабза
Какова длина носа Статуи Свободы?,География,"1,37 м",0,76 м,0,"1,37 м"
Кому из этих героев удалось бежать после падения Трои?,История,Эней,Парис,Троил,Гектор,Эней
"Из какого языка пришло слово ""алгебра""? ",Наука,Арабского,Греческого,Санскрита,Иврита,Арабского
