question,Subject,answer1,answer2,answer3,answer4,Correct_answer
Какая единица в системе СИ носит имя изобретателя Николы Тесла?,Наука,Магнитной индукции,Электрической проводимости,Радиоактивности,Напряжения,Магнитной индукции
Гибрид каких злаков называется ТРИТИКАЛЕ?,Природа и животный мир,Рожь и пшеница,Овес и рис,Просо и ячмень,Пшеница и ячмень,Рожь и пшеница
Сколько опер написано Бетховеном?,Искусство,1 (Фиделио),2,3,4,1 (Фиделио)
"Что в царской России, кроме обычного инвентаря, входило в экипировку дворника? ",История,Свисток,Револьвер,Сабля,Жезл,Свисток
Из какой пьесы Чехова Фаина Раневская взяла свой псевдоним?,Литература,"""Вишневый сад""","""Три сестры"""," ""Свадьба"""," ""Чайка""","""Вишневый сад"""
"От названия какой части ноги произошло английское слово ""футбол""? ",Спорт,ступня,голень,колено,бедро,ступня
Каким было полное имя набоковской Лолиты?,Литература,Долорес,Лора,Лаура,Элоиза,Долорес
В какой стране в Средние века был впервые получен этиловый спирт?,История,Италия,Россия,Германия,Франция,Италия
Как назывался город Алма-Ата до 1921 г.?,История,Верный,Гордый,Крепкий,Твердый,Верный
"Во время какого крестьянского восстания происходит действие пушкинской ""Капитанской дочки""? ",Литература,Емельяна Пугачева,Нестора Махно,Степана Разина,Ивана Болотникова,Емельяна Пугачева
"На пьедестале чьего памятника высечены слова: ""Остановивший Солнце, сдвинувший Землю""? ",Разное,Николай Коперник,Галилео Галилей,Джордано Бруно,Клавдий Птолемей,Николай Коперник
Что означает название месяца октябрь?,Разное,восьмой,жёлтый,дождливый,десятый,восьмой
Какой стиль изложения по-книжному называется лапидарным?,Литература,"Краткий, четкий, ясный",Замысловатый,цветистый,Наукообразный,"Краткий, четкий, ясный"
Какое море называют дамским?,География,Саргассово,Адриатическое,Мраморное,Тасманово,Саргассово
"Какой английский футбольный клуб называют ""дачниками""? ",Спорт,Фулхэм,Эвертон,Астон Вилла,Болтон,Фулхэм
Назовите старшую из великих княжон - дочерей Николая II,История,Ольга,Анастасия,Мария,Татьяна,Ольга
С кем сравнивает себя находящийся в постоянных хлопотах человек?,Разное,С белкой в колесе,С пауком в банке,С белкой в колесе,С птицей в клетке,С белкой в колесе
Сколько струн у контрабаса?,Искусство,4,3,5,6,4
"Назовите имя учёного монаха, который первым предложил в 525 г. вести начало счёта годов от рождества Христова. ",История,Дионисий,Гимелий,Парфений,Климентий,Дионисий
"Кто написал сказку ""Спящая царевна""? ",Литература,В. А. Жуковский,И. А. Крылов,М. В. Ломоносов,А. П. Чехов,В. А. Жуковский
Какое море соединяется с Мраморным проливом Босфор?,География,Черное,Адриатическое,Эгейское,Средиземное,Черное
Среди какого народа долго жил Миклухо-Маклай?,История,Папуасы,Маори,Алеуты,Самоанцы,Папуасы
"Как звали Чацкого из ""Горе от ума""? ",Литература,Александр Андреевич,Алексей Андреевич,Александр Сергеевич,Андрей Александрович,Александр Андреевич
В каком городе находится мечеть с самым высоким в мире минаретом?,География,Касабланка,Стамбул,Мекка,Джакарта,Касабланка
"Какой советский космический корабль в 1975 году пристыковался к американскому ""Аполлону""? ",История,"""Союз-19""","""Восток-6"""," ""Восход-2"""," ""Прогресс-8""","""Союз-19"""
В какой стране расположен город Антверпен?,География,Бельгия,Нидерланды,Дания,Германия,Бельгия
Чем скрепляются между собой различные металлические элементы Эйфелевой башни?,Разное,заклёпками,болтами,сварными швами,шурупами-саморезами,заклёпками
Что в 1966 году открыли Советские ученые в Антарктике на глубине трех километров?,Наука,Пресное озеро,Затонувший корабль,Огромный метеорит,Залежи урана,Пресное озеро
"В каком году было т. н. Кровавое воскресенье в Лондондерри, Сев. Ирландия? ",История,1972,1969,1976,1974,1972
Сколько мест в стандартном российском плацкартном вагоне?,Разное,54,48,52,56,54
"Какой плод на латыни называется ""армянской сливой""? ",Природа и животный мир,абрикос,алыча,персик,айва,абрикос
Сколько длилась дней Великая Отечественная Война?,История,1418,1520,1456,1475,1418
Раньше в примитивных светильниках использовалось деревянное масло. Что это за масло?,Разное,Оливковое,Подсолнечное,Льняное,Рыбий жир,Оливковое
В какой стране в 1960 году Сиримаво Бандаранаике стала первой женщиной премьер-министром?,История,Шри-Ланка,Малайзия,Тайланд,Пакистан,Шри-Ланка
"Полуостров, разделяющий моря Карское и Лаптевых. ",География,Таймыр,Атолл,Новая Земля,Сахалин,Таймыр
"Сколько попыток в самом начале игры даётся игроку в боулинг, чтобы сбить 10 кеглей? ",Спорт,Две,Одна,Три,Четыре,Две
Укажите годы жизни М. Мусоргского?,Искусство,1839-1881,1891-1953,1840-1893,1792-1856,1839-1881
Какой хореограф более 30 лет сотрудничал с композитором Игорем Стравинским?,Искусство,Джордж Баланчин,Майа Плисецкая,Михаил Барышников,Марта Грэм,Джордж Баланчин
"Какой из легковых автомобилей, производившихся в бывших соц. странах, был фактически советской ""Победой""? ",Разное,"""Варшава""","""Дачиа"""," ""Застава"""," ""Трабант""","""Варшава"""
Как зовут главных героев повести ''Ночевала тучка золотая'' А.Приставкина?,Литература,Саша и Коля,Саша и Петя,Саша и Вася,Саша и Ваня,Саша и Коля
Чьими снами интересовались поэт Михаил Матусовский и композитор Владимир Шаинский в совместной песне?,Искусство,Крейсера «Аврора»,Медного всадника,Исаакиевского собора,Ростральной колонны,Крейсера «Аврора»
"В чьи обязанности вxодит указывать крановщику, как поднимать и куда доставлять груз? ",Разное,Такелажник,Кровельщик,Каменщик,Плановик,Такелажник
Кто от имени советского Верховного Главнокомандования принял капитуляцию фашистской Германии?,История,Жуков,Рокосовский,Конев,Молотов,Жуков
В каком городе происходит действие фильма «Асса»?,Фильмы,Ялта,Алушта,Сочи,Кисловодск,Ялта
Действие какой из новелл Проспера Мериме протекает на Корсике?,Литература,"""Маттео Фальконе""","""Таманго"""," ""Партия в триктрак"""," ""Этрусская ваза""","""Маттео Фальконе"""
Как в СССР называлась одна из разновидностей лотереи?,Разное,"""Спринт""","""Старт"""," ""Кросс"""," ""Ринг""","""Спринт"""
"Кто написал поэму ""Ода к радости""? ",Литература,Фридрих Шиллер,Мартин Лютер,Иоганн Вольфганг фон Гёте,Генрих Гейне,Фридрих Шиллер
Информацию о чём содержит в себе древнеегипетский папирус Ринда?,История,Математика,Политика,Религия,Любовь,Математика
Как зовут самую знаменитую героиню детской писательницы Памелы Трэверс?,Литература,Мэри Поппинс,Пеппи Длинный чулок,Тутта Карлссон,Гермиона Грейнджер,Мэри Поппинс
В каком чине был выпущен из лицея Александр Пушкин?,Литература,Коллежский секретарь,Надворный советник,Коллежский регистратор,Титулярный советник,Коллежский секретарь
"""Фирменным"" спектаклем какого театра является ""Принцесса Турандот""? ",Искусство,Имени Вахтангова,"""Ленком""",Сатиры,БДТ,Имени Вахтангова
Что поручено охранять сотне стражников швейцарской гвардии?,История,папу и Ватикан,штаб-квартиру ООН,Букингемский дворец,Белый дом в Вашингтоне,папу и Ватикан
"Автор романа ""Триумфальная арка""?",Литература,Ремарк,Дюма,Пикуль,Конан Дойль,Ремарк
Какой советский маршал в 1948 году стал министром национальной обороны Польши?,История,Рокоссовский,Малиновский,Жуков,Конев,Рокоссовский
"Какой из этих романов написан не кем-нибудь из сестер Бронте (Шарлоттой, Эмили или Анной)? ",Литература,Аргонавты,Шерли,Агнес Грей,Грозовой перевал,Аргонавты
Детективные произведения какого автора почти всегда связаны со скачками и скаковыми лошадьми?,Литература,Дик Фрэнсис,Джеймс Чейз,Гордон Диксон,Филипп Дик,Дик Фрэнсис
Что можно сделать с помощью постромок?,Разное,запрячь лошадь,научиться плавать,посеять что-либо,повесить картину,запрячь лошадь
С какого события начинается летоисчисление древних Греков?,История,С первой олимпиады,Троянская война,Сотворение мира,Основание Афин,С первой олимпиады
"Рыба, вьющая гнезда в заросляx водорослей. ",Природа и животный мир,Морская колюшка,Угорь,Осетр,Камбала,Морская колюшка
"Слово ""энциклопедия"" греческого происхождения. Что оно означает дословно? ",История,Обучение в полном круге,Широкий круг сведений,Детский кружок творчества,Фундамент образования,Обучение в полном круге
Древнее название этой столицы европейского государства — Виндобона.,История,Вена,Вадуц,Вильнюс,Лиссабон,Вена
"Название какого европейского города первоначально означало ""датский город""? ",История,Таллин,Данди,Дюнкерк,Гданьск,Таллин
"В песне в поётся: ""Что стоишь, качаясь, тонкая рябина, головой склоняясь до самого тына"". А что такое ""тын""? ",Разное,Забор,Задняя стена дома,Крыльцо,Сеновал,Забор
Как называлась первая династия франков?,История,Меровинги,Каролинги,Капетинги,Валуа,Меровинги
"Кого, кроме Гамлета, играл в народном театре Юрий Деточкин — герой фильма «Берегись автомобиля»? ",Фильмы,Чацкого,Хлестакова,Онегина,Отелло,Чацкого
Какой математический знак указывает на порядок действий?,Наука,Скобки,Равно,Интеграл,Модуль,Скобки
В каком городе родилась известная актриса Фаина Раневская?,Искусство,Таганрог,Москва,Одесса,Ялта,Таганрог
Сколько шашек находится на доске в начале партии в русские шашки?,Разное,24,12,36,40,24
"Какой показатель является неизменным в автогонках, с 1923 года проходящих около французского города Ла-Ман? ",Спорт,время,скорость,количество участников,расстояние,время
Здание какого вокзала Москвы спроектировал архитектор К.Тон - автор Оружейной палаты Кремля?,История,Ленинградского,Курского,Киевского,Рижского,Ленинградского
"Как звали следователя из романа Ф. М. Достоевского ""Преступление и наказание""? ",Литература,Порфирий Петрович,Перфилий Павлович,Порфирий Павлович,Перфилий Петрович,Порфирий Петрович
Кто был первым программистом?,Наука,Ада Байрон,Чарльз Беббидж,Блез Паскаль,Билл Гейтс,Ада Байрон
Какой остров самый большой по площади в мире?,География,Гренландия,Калимантан,Австралия,Сахалин,Гренландия
"Сколько кораблей вернулось, совершив первое кругосветное плаванье в экспедиции Магеллана, в Севилью? ",История,Один,Два,Три,Четыре,Один
Когда возникло первое славянское государственное образование на Балканском п-ове - Семь славянский племён?,История,7-й век,5-й век,6-й век,8-й век,7-й век
Кто из этих великих художников долго жил на Таити?,Искусство,Гоген,Сезанн,Дега,Матисс,Гоген
Как герой фильма «Белорусский вокзал» назвал свой батальон?,Фильмы,Непромокаемый,Непотопляемый,Непобедимый,Неприступный,Непромокаемый
Самая высокая гора мира?,География,Эверест,Аконкагуа,Килиманджаро,Мак-Кинли,Эверест
"Какой английский писатель придумал слово ""лилипут""? ",Литература,Джонатан Свифт,Даниель Дефо,Уильям Теккерей,Чарльз Диккенс,Джонатан Свифт
"Какую кличку носил герой Миронова из кинофильма ""Бриллиантовая рука""(по сценарию)? ",Фильмы,"Граф (Геннадий Петрович Козодоев, он же Геша)",Князь,Барон,Купец,"Граф (Геннадий Петрович Козодоев, он же Геша)"
В каком городе родился пророк Мухаммед (Магомет)?,История,Мекка,Медина,Мемфис,Дамаск,Мекка
"Что означает немецкое словосочетание ""крафт тойфель"", от которого произошло слово ""картофель""? ",Разное,Дьявольская сила,Земляная пища,Чудесный плод,Богатырский дух,Дьявольская сила
Кто из русских царей написал свод уставов по соколиной охоте?,История,Алексей Михайлович,Иван Грозный,Пётр I,Пётр III,Алексей Михайлович
Какое ремесло возрождал в России Михаил Васильевич Ломоносов?,История,Мозаику,Керамику,Литьё,Ковку,Мозаику
Как звали мать Родиона Раскольникова?,Литература,Пульхерия Александровна,Авдотья Романовна,Марфа Петровна,Лизавета Ивановна,Пульхерия Александровна
Какая из пряностей приготавливается из цветочных бутонов?,Природа и животный мир,Гвоздика,Горчица,Корица,Тмин,Гвоздика
Музыку какого композитора Андрей Тарковский использовал в фильме «Солярис»?,Фильмы,Бах,Моцарт,Бетховен,Гендель,Бах
4 пенса в старину?,История,Гроут,Фартинг,Полукрона,Шиллинг,Гроут
Что такое наргиле?,Разное,Вид кальяна,Сорт сливы,Арбузный мед,Верблюжья колючка,Вид кальяна
Какой из этих диснеевских мультфильмов был создан раньше остальных?,Фильмы,"""Белоснежка и семь гномов""","""Бемби"""," ""Золушка"""," ""Пиноккио""","""Белоснежка и семь гномов"""
Какое из этих старинных орудий имело длинный ствол и применялось для стрельбы на дальние расстояния?,История,Кулеврина,Единорог,Мортира,Пищаль,Кулеврина
Чем становятся абрикосы высушенные вместе с косточкой?,Разное,Урюком,Курагой,Кайсой,Сабзой,Урюком
Какова высота футбольных ворот?,Спорт,244 см (8 футов),200 см,264 см,190 см,244 см (8 футов)
Источником какого металла является минерал киноварь?,Наука,Ртути,Вольфрама,Железа,Меди,Ртути
"Как называют музыканта, играющего на сопилке? ",Искусство,сопилкарь,сопильник,соплист,сопилюшник,сопилкарь
Кто забил решающий мяч за сборную Франции в финале чемпионата Европы по футболу 2000 года?,Спорт,Трезеге,Зидан,Анри,Вильторд,Трезеге
"На какого популярного в начале 70-х певца сочинили эпиграмму ""Прекрасно быть певцом и со своим лицом!""? ",Искусство,Кола Бельды,Муслим Магомаев,Эдуард Хиль,Иосиф Кобзон,Кола Бельды
"Как звали одного из самых колоритных персонажей оперетты Кальмана ""Принцесса цирка""? ",Искусство,Пеликан,Баклан,Фламинго,Буревестник,Пеликан
В каком стиле работал архитектор Растрелли?,Искусство,Барокко,Готика,Классицизм,Рококо,Барокко
Какой штат наименьший по площади в США?,География,Род-Айленд,Канзас,Коннектикут,Делавэр,Род-Айленд
Когда празднуют Всемирный день здоровья?,Разное,В апреле,В январе,В августе,В ноябре,В апреле
"Кто сказал ""Государство - это я!""? ",История,Людовик XIV,Октавиан Август,Наполеон Бонапарт,Борис Березовский,Людовик XIV
В каком заповеднике в 1991 году произошло тайное подписание акта о расформировании СССР?,История,Беловежская пуща,Тебердинский,Шульган-Таш,Брянский лес,Беловежская пуща
"На основе какого напитка готовится коктейль ""Маргарита""? ",Разное,Текила,Ром,Водка,Коньяк,Текила
"Как звучит полное имя главной героини повести Тургенева ""Ася""? ",Литература,Анна,Анастасия,Александра,Ксения,Анна
"Как звучит буквальный перевод с французского юридического термина ""форс-мажор""? ",Разное,Непреодолимая сила,Внезапное событие,Изменение условий,Безвыходная ситуация,Непреодолимая сила
Как называется место для одного локомотива в железнодорожном депо?,Разное,Стойло,Гараж,Ангар,Сектор,Стойло
"Как полиграфисты называют привычную нам форму книги, пришедшую на смену древним свиткам? ",Литература,Кодекс,Суффикс,Люрекс,Журфикс,Кодекс
Как называется свод условных знаков и пояснений к карте?,География,Легенда,Абрис,Кроки,Кодекс,Легенда
В какой столице состоялся первый конкурс российских красавиц?,Разное,Париж,Петербург,Москва,Лондон,Париж
